{
  "canto": "Par. XVI",
  "cantica": "Paradiso",
  "canto_num": 16,
  "verified": true,
  "subtitle_ua": "П'яте небо · Марс · Каччаґвіда · Знатні роди старої Флоренції",
  "summary_ua": "Каччаґвіда перелічує старі флорентійські роди, які керували містом, — більшість їх уже позникала або здрібніла. Пояснює, як прихід нових мешканців із сільських округ зіпсував цивільну рівновагу. Данте з гордістю вживає архаїчне шанобливе звертання «ви» до предка, хоч Беатріче усміхається над цією пихою.",
  "connections": [
    {
      "id": "par_xvi_01",
      "dante_ref": "XVI, 13–15",
      "dante_sub": "Беатріче усміхнулася, як дама з Малеота",
      "source_ref": "Lanc. propre, Micha VIII, 49–50",
      "source_sub": "дама з Малеота кашлянула при першому поцілунку",
      "source_author": "Прозовий Ланселот",
      "type": "ALLUSION",
      "confidence": "HIGH",
      "desc_dante": "Данте порівнює усмішку Беатріче з поведінкою дами з Малеота, яка кашлянула, коли Джиневра вперше поцілувала Ланселота. Беатріче, як і дама з Малеота, мовчки дає знак, що бачить слабкість Данте (гордість родом).",
      "desc_source": "У прозовому Ланселоті дама з Малеота (la Dame de Malehaut) присутня при першому поцілунку Джиневри та Ланселота, влаштованому Галеотом. Вона кашляє, аби показати, що помітила цю таємну сцену, але нікому не зраджує.",
      "chain": null
    },
    {
      "id": "par_xvi_02",
      "dante_ref": "XVI, 1–6",
      "dante_sub": "марнота шляхетності крові",
      "source_ref": "Sat. VIII, 1–20",
      "source_sub": "що вартують родоводи?",
      "source_author": "Ювенал",
      "type": "THEMATIC",
      "confidence": "HIGH",
      "desc_dante": "Данте відкриває canto вигуком «O poca nostra nobilta di sangue!» (О мізерна наша шляхетність крові!) - родова гордість є марнотою, бо тут, де бажання не хилиться до хибного, він сам пишався нею.",
      "desc_source": "Ювенал відкриває Сатиру VIII запитанням «Stemmata quid faciunt?» (Що вартують родоводи?) і стверджує, що єдина справжня шляхетність - це доброчесність. Довгі генеалогії безглузді, якщо нащадок негідний своїх предків.",
      "chain": null
    },
    {
      "id": "par_xvi_03",
      "dante_ref": "XVI, 73–154",
      "dante_sub": "каталог флорентійських родів",
      "source_ref": "Aen. VII, 641–817",
      "source_sub": "каталог латинських і рутульських воїнів",
      "source_author": "Вергілій",
      "type": "STRUCTURE",
      "confidence": "HIGH",
      "desc_dante": "Каччаґвіда перелічує десятки флорентійських родів, описуючи їхній колишній блиск і занепад. Структура розлогого каталогу з короткими характеристиками кожного роду відтворює модель епічного каталогу.",
      "desc_source": "В Aeneis VII Вергілій подає розгорнутий каталог італійських воїнів, які виступили проти троянців: кожен вождь отримує коротку характеристику з генеалогічною довідкою. Ця каталожна структура стала зразком для середньовічних переліків знатних родів.",
      "chain": null
    },
    {
      "id": "par_xvi_04",
      "dante_ref": "XVI, 73–154",
      "dante_sub": "каталог родів як епічний перелік",
      "source_ref": "Il. II, 484–877",
      "source_sub": "каталог кораблів і вождів ахейців",
      "source_author": "Гомер",
      "type": "STRUCTURE",
      "confidence": "MEDIUM",
      "desc_dante": "Каталог флорентійських родів у Каччаґвіди є віддаленим нащадком гомерівського каталогу кораблів - першого великого переліку в європейській літературі. Данте успадковує цю форму через Вергілія.",
      "desc_source": "В Іліаді II Гомер перелічує ахейські контингенти із зазначенням їхніх вождів, батьківщини та кількості кораблів. Цей каталог став прототипом усіх подальших епічних переліків, зокрема Вергілієвого каталогу в Aeneis VII.",
      "chain": [
        {
          "ref": "Aen. VII, 641–817",
          "author": "Вергілій",
          "sub": "каталог італійських воїнів",
          "desc": "Вергілій адаптує гомерівську каталожну форму у книзі VII Енеїди, створюючи перелік латинських і рутульських вождів. Данте знав гомерівську традицію саме через Вергілієву адаптацію."
        }
      ]
    },
    {
      "id": "par_xvi_05",
      "dante_ref": "XVI, 67–69",
      "dante_sub": "змішування людей - початок зла міста",
      "source_ref": "Gen. 11:1–9",
      "source_sub": "змішання мов і розсіяння народів при Вавилонській вежі",
      "source_author": "Біблія",
      "type": "THEMATIC",
      "confidence": "MEDIUM",
      "desc_dante": "Каччаґвіда проголошує: «sempre la confusion de le persone / principio fu del mal de la cittade» - змішування людей завжди було причиною зла міста. Слово «confusion» відлунює біблійне «confusio» Вавилону.",
      "desc_source": "У книзі Буття Бог змішує мови людей, які будували Вавилонську вежу, і розсіює їх по землі. Назва Вавилон (Babel) етимологічно пов'язана з «balal» (змішувати). Змішання і розсіяння як покарання за гординю - біблійний архетип.",
      "chain": null
    },
    {
      "id": "par_xvi_06",
      "dante_ref": "XVI, 46–72",
      "dante_sub": "де нині ці роди?",
      "source_ref": "Cons. II, pr. 7, 8–12",
      "source_sub": "де кості Фабриція? Де Катон?",
      "source_author": "Боецій",
      "type": "THEMATIC",
      "confidence": "MEDIUM",
      "desc_dante": "Каччаґвіда перелічує родини, що колись були славними, а нині зникли або занепали. Ця риторична модель - ubi sunt (де нині вони?) - є однією з ключових тем середньовічної медитації про минущість земної слави.",
      "desc_source": "В Consolatio Philosophiae II Боецій запитує, де нині кості вірного Фабриція, де суворий Брут або Катон. Філософія показує, що земна слава минуща і навіть найвеличніші імена зникають. Ubi sunt - риторична модель, яку Данте застосовує до флорентійських родів.",
      "chain": null
    },
    {
      "id": "par_xvi_07",
      "dante_ref": "XVI, 73–78",
      "dante_sub": "Луні та Урбізалья зникли",
      "source_ref": "Phars. I, 70–82",
      "source_sub": "великі держави руйнуються під власною вагою",
      "source_author": "Лукан",
      "type": "THEMATIC",
      "confidence": "MEDIUM",
      "desc_dante": "Каччаґвіда наводить Луні та Урбізалью як приклади міст, що зникли, і попереджає, що Кьюзі та Сініґалья підуть за ними. Тема неминучого занепаду навіть найбільших міст.",
      "desc_source": "У Pharsalia I Лукан формулює закон: «in se magna ruunt» - великі держави руйнуються під власною вагою. Рим, що виріс надміру, став жертвою власної величі. Ця теза про невідворотність занепаду переростає у топос, який Данте застосовує до тосканських міст.",
      "chain": null
    },
    {
      "id": "par_xvi_08",
      "dante_ref": "XVI, 73–75",
      "dante_sub": "Луні як зниклі місто",
      "source_ref": "Phars. I, 584–586",
      "source_sub": "Аррунс із пустельних мурів Луни",
      "source_author": "Лукан",
      "type": "ALLUSION",
      "confidence": "MEDIUM",
      "desc_dante": "Данте називає Луні серед міст, що зникли: «Se tu riguardi Luni... come son ite». Вибір саме цього міста як прикладу занепаду перегукується з Луканом, у якого Луна вже описана як покинута.",
      "desc_source": "У Pharsalia I Лукан представляє етруського віщуна Аррунса, який мешкає «desertae moenia Lunae» (серед мурів покинутої Луни). Вже в часи Лукана Луна була напівзанедбаним містом, і Данте посилює цей образ до повного зникнення.",
      "chain": null
    },
    {
      "id": "par_xvi_09",
      "dante_ref": "XVI, 49–57",
      "dante_sub": "чистота старої Флоренції без прийшлих",
      "source_ref": "Sat. III, 60–80",
      "source_sub": "скарга Умбриція на греків у Римі",
      "source_author": "Ювенал",
      "type": "THEMATIC",
      "confidence": "MEDIUM",
      "desc_dante": "Каччаґвіда оплакує, що до Флоренції переселилися люди з Кампі, Чертальдо та Фіджіне. Стара, чиста Флоренція зіпсована прибульцями - скарга на імміграцію як причину занепаду міста.",
      "desc_source": "У Сатирі III Ювенал вкладає в уста Умбриція скаргу на те, що Рим заполонили греки та сирійці: «non possum ferre, Quirites, Graecam urbem». Чужинці витісняють корінних римлян, руйнуючи давні звичаї. Топос «прибульці руйнують місто» є спільним.",
      "chain": null
    }
  ]
}
