{
  "canto": "Par. XXIV",
  "cantica": "Paradiso",
  "canto_num": 24,
  "verified": true,
  "subtitle_ua": "Восьме небо · Нерухомі зорі · Петро · Іспит про віру",
  "summary_ua": "Апостол Петро спускається, щоб екзаменувати Данте про віру. Данте визначає віру як основу/підставу сподіваних речей (Євр. 11:1), свідчить про Трійцю, посилається на Старий і Новий Завіт. Петро, задоволений, тричі обертається навколо нього, співаючи.",
  "connections": [
    {
      "id": "par_xxiv_01",
      "dante_ref": "XXIV, 1-2",
      "dante_sub": "велика вечеря благословенного Агнця",
      "source_ref": "Apoc. 19:9",
      "source_sub": "блаженні покликані на весільну вечерю Агнця",
      "source_author": "Біблія",
      "type": "ALLUSION",
      "confidence": "HIGH",
      "desc_dante": "Данте звертається до блаженних душ як до «обраного братства великої вечері благословенного Агнця, який вас годує». Образ небесного бенкету прямо алюзує на апокаліптичну вечерю.",
      "desc_source": "В Апокаліпсисі ангел велить Іоанну записати: «Beati qui ad cenam nuptiarum Agni vocati sunt» - блаженні покликані на весільну вечерю Агнця. Це есхатологічний образ остаточного єднання праведних із Богом.",
      "chain": null
    },
    {
      "id": "par_xxiv_02",
      "dante_ref": "XXIV, 10-18",
      "dante_sub": "танцюючі вогні блаженних душ",
      "source_ref": "Aen. VI, 637-644",
      "source_sub": "душі в Елізіумі танцюють і співають",
      "source_author": "Вергілій",
      "type": "THEMATIC",
      "confidence": "MEDIUM",
      "desc_dante": "Данте описує блаженних, що обертаються у танці з різною швидкістю, подібно до коліс у годиннику. Вогняні кола душ танцюють навколо Беатріче, випромінюючи радість.",
      "desc_source": "В Aeneis VI Еней бачить душі на Елісейських полях: вони танцюють на зеленій галявині, співають пеан, і Орфей акомпанує їм на лірі. Мотив танцюючих блаженних душ у потойбіччі є класичним топосом.",
      "chain": null
    },
    {
      "id": "par_xxiv_03",
      "dante_ref": "XXIV, 34-51",
      "dante_sub": "Петро екзаменує Данте з віри",
      "source_ref": "Matt. 16:15-19",
      "source_sub": "Христос питає Петра: за кого мене вважаєш?",
      "source_author": "Біблія",
      "type": "INVERSION",
      "confidence": "HIGH",
      "desc_dante": "Апостол Петро виступає екзаменатором Данте, ставлячи йому питання про сутність віри. Роль перевернута: у Євангелії Христос екзаменував Петра, тут Петро екзаменує смертного.",
      "desc_source": "У Євангелії від Матвія Ісус питає учнів у Кесарії Пилипа: «А ви за кого мене вважаєте?» Петро відповідає: «Ти Христос, Син Бога живого», і отримує ключі Царства Небесного. Ця сцена закріплює за Петром авторитет першого сповідника віри.",
      "chain": null
    },
    {
      "id": "par_xxiv_04",
      "dante_ref": "XXIV, 64-66",
      "dante_sub": "віра - сутність речей сподіваних",
      "source_ref": "Heb. 11:1",
      "source_sub": "визначення віри в Посланні до Євреїв",
      "source_author": "Біблія",
      "type": "ALLUSION",
      "confidence": "HIGH",
      "desc_dante": "Данте дає визначення віри, дослівно перекладаючи з латинської Вульгати: «fede e sustanza di cose sperate / e argomento de le non parventi» - віра є сутністю речей сподіваних і доказом невидимих.",
      "desc_source": "Послання до Євреїв визначає: «Est autem fides sperandarum substantia rerum, argumentum non apparentium» - віра є основою того, на що сподіваємось, і доказом того, чого не бачимо. Це найвідоміше біблійне визначення віри, яке Данте цитує дослівно.",
      "chain": null
    },
    {
      "id": "par_xxiv_05",
      "dante_ref": "XXIV, 91-93",
      "dante_sub": "широкий дощ Святого Духа на Писання",
      "source_ref": "Ioel 2:28-29",
      "source_sub": "виллю Духа Мого на всяку плоть",
      "source_author": "Біблія",
      "type": "ALLUSION",
      "confidence": "MEDIUM",
      "desc_dante": "Данте описує джерело своєї віри: «широкий дощ Святого Духа, розлитий на старих і нових шкірах» - натхнення Духа, що пронизує тексти Старого і Нового Завіту.",
      "desc_source": "Пророк Йоіл проголошує: «effundam spiritum meum super omnem carnem» - виллю Духа Мого на всяку плоть. Образ виливання/дощу Духа стає ключовою біблійною метафорою божественного натхнення, яку Данте адаптує для опису інспірації Писання.",
      "chain": null
    },
    {
      "id": "par_xxiv_06",
      "dante_ref": "XXIV, 137-138",
      "dante_sub": "через Мойсея, пророків, псалми, Євангеліє",
      "source_ref": "Luc. 24:27",
      "source_sub": "від Мойсея і пророків витлумачив їм усе Писання",
      "source_author": "Біблія",
      "type": "ALLUSION",
      "confidence": "MEDIUM",
      "desc_dante": "Данте перелічує джерела своєї віри: Мойсей, пророки, псалми, Євангеліє та послання апостолів. Цей каталог священних текстів повторює формулу воскреслого Христа.",
      "desc_source": "В Євангелії від Луки воскреслий Ісус на дорозі до Еммаусу пояснює двом учням: «incipiens a Mose et omnibus prophetis interpretabatur illis in omnibus scripturis» - починаючи від Мойсея й усіх пророків, витлумачив їм у всьому Писанні, що стосувалося Його.",
      "chain": null
    },
    {
      "id": "par_xxiv_07",
      "dante_ref": "XXIV, 148-154",
      "dante_sub": "Петро тричі обертається навколо Данте зі співом",
      "source_ref": "Is. 6:3",
      "source_sub": "серафими тричі вигукують: Святий, Святий, Святий",
      "source_author": "Біблія",
      "type": "THEMATIC",
      "confidence": "MEDIUM",
      "desc_dante": "Святий Петро тричі оточує Данте, співаючи благословення. Потрійне обертання зі співом є ритуальним жестом схвалення, що перегукується з потрійною небесною хвалою.",
      "desc_source": "У видінні пророка Ісаї серафими проголошують потрійне «Sanctus, sanctus, sanctus Dominus Deus exercituum» - Трисвяте як найвищу форму небесної хвали. Потрійний ритм стає архетипом сакральної дії.",
      "chain": null
    }
  ]
}
