{
  "canto": "Par. XIX",
  "cantica": "Paradiso",
  "canto_num": 19,
  "verified": true,
  "subtitle_ua": "Шосте небо · Юпітер · Орел справедливості · Таємниця Божого суду · Корумповані королі",
  "summary_ua": "Орел говорить, як одна особа; відповідає на давній сумнів Данте про язичника-праведника, який не знав Христа: Божа справедливість трансцендентна для обмеженого розуму. Орел перераховує християнських королів-негідників, порівнюючи їхні злочини з чеснотами «праведних язичників».",
  "connections": [
    {
      "id": "par_xix_01",
      "dante_ref": "XIX, 58-63",
      "dante_sub": "безодня божественної справедливості",
      "source_ref": "Rom. 11:33-36",
      "source_sub": "о глибино багатства, мудрості й знання Божого",
      "source_author": "Біблія",
      "type": "ALLUSION",
      "confidence": "HIGH",
      "desc_dante": "Орел каже, що перший Божий акт волі, який є сам по собі верховним благом, ніколи не відступав від Себе, і все, що з Нього випромінюється, є лише Його відблиском. Безодня божественної справедливості перевищує будь-яке людське бачення.",
      "desc_source": "Апостол Павло вигукує: «O altitudo divitiarum sapientiae et scientiae Dei! Quam incomprehensibilia sunt iudicia eius et investigabiles viae eius!» Цей пасаж є центральним біблійним джерелом теми незбагненності Божого суду.",
      "chain": null
    },
    {
      "id": "par_xix_02",
      "dante_ref": "XIX, 79-81",
      "dante_sub": "хто ти, щоб судити Бога?",
      "source_ref": "Rom. 9:20-21",
      "source_sub": "глина не може питати гончаря",
      "source_author": "Біблія",
      "type": "ALLUSION",
      "confidence": "HIGH",
      "desc_dante": "Орел ставить риторичне запитання: «Or tu chi se, che voi sedere a scranna / per giudicar di lungi mille miglia / con la veduta corta d'una spanna?» - хто ти, щоб сісти суддею над тим, що за тисячу миль від тебе, коли твій зір - п'ядь завдовжки?",
      "desc_source": "Павло пише: «O homo, tu quis es, qui respondeas Deo? Numquid dicit figmentum ei, qui se finxit: Quid me fecisti sic?» Образ глини, яка не має права питати гончаря чому він зліпив її так, а не інакше - архетип аргументу проти людської зарозумілості у богословській традиції.",
      "chain": null
    },
    {
      "id": "par_xix_03",
      "dante_ref": "XIX, 40-45",
      "dante_sub": "людський розум не бачить першопричини",
      "source_ref": "Sap. 9:13-17",
      "source_sub": "хто з людей збагне Божий задум?",
      "source_author": "Біблія",
      "type": "THEMATIC",
      "confidence": "MEDIUM",
      "desc_dante": "Орел пояснює, що тварний зір, яким би гострим він не був, не може осягнути вічну справедливість, бо створений інтелект завжди залишається нижчим за свого Творця.",
      "desc_source": "У Книзі Премудрості запитується: «Quis enim hominum poterit scire consilium Dei? Aut quis poterit cogitare quid velit Dominus?» Людський розум ледве збагне земне, а небесне - хто дослідить?",
      "chain": null
    },
    {
      "id": "par_xix_04",
      "dante_ref": "XIX, 79-90",
      "dante_sub": "Бог відповідає тому, хто зважився судити",
      "source_ref": "Iob 38:1-7",
      "source_sub": "Бог запитує Йова: де ти був?",
      "source_author": "Біблія",
      "type": "THEMATIC",
      "confidence": "MEDIUM",
      "desc_dante": "Орел продовжує допит: тисячі миль від предмета суду, а зір - п'ядь завдовжки. Логіка аргументу повторює структуру Божої відповіді Йову: виклик людській самовпевненості через вказівку на непорівнянність масштабів.",
      "desc_source": "Бог відповідає Йову з бурі: «Ubi eras quando ponebam fundamenta terrae?» Серія риторичних запитань демонструє безмежну прірву між людським і божественним знанням, встановлюючи архетип для всіх наступних текстів про незбагненність Божого плану.",
      "chain": null
    },
    {
      "id": "par_xix_05",
      "dante_ref": "XIX, 106-111",
      "dante_sub": "погани ближчі до Христа, ніж багато хто з хрещених",
      "source_ref": "Mt. 7:21-23",
      "source_sub": "не кожен, хто каже Господи, Господи",
      "source_author": "Біблія",
      "type": "ALLUSION",
      "confidence": "HIGH",
      "desc_dante": "Орел заявляє, що деякі, хто кличе «Христе, Христе!», будуть далі від Нього на Суді, ніж інші, що не знали Христа. Данте майже дослівно перефразовує євангельське застереження.",
      "desc_source": "Христос каже: «Non omnis qui dicit mihi, Domine, Domine, intrabit in regnum caelorum.» Ті, хто зовні сповідує віру, але не чинить волю Отця, будуть відкинуті на Суді, попри свої запевнення.",
      "chain": null
    },
    {
      "id": "par_xix_06",
      "dante_ref": "XIX, 115-148",
      "dante_sub": "каталог негідних християнських королів",
      "source_ref": "Aen. VI, 756-853",
      "source_sub": "парад майбутніх римських героїв",
      "source_author": "Вергілій",
      "type": "INVERSION",
      "confidence": "MEDIUM",
      "desc_dante": "Орел розгортає довгий каталог сучасних Данте християнських королів, перелічуючи їхні злочини: Альберт Габсбурзький, Філіп Красивий, англійський та шотландський королі, чеський та інші. Це анти-каталог: замість слави - ганьба.",
      "desc_source": "В Aeneis VI Анхіз показує Енеєві процесію майбутніх римських героїв від Сильвія до Авґуста і Марцелла. Парад героїв є каталогом слави і чесноти, який Данте інвертує: замість прославлення майбутніх лідерів - викриття сучасних правителів як ганьби християнського світу.",
      "chain": null
    },
    {
      "id": "par_xix_07",
      "dante_ref": "XIX, 58-63",
      "dante_sub": "безодня суду Божого",
      "source_ref": "Ps. 35:7",
      "source_sub": "суди Твої - безодня велика",
      "source_author": "Біблія",
      "type": "ALLUSION",
      "confidence": "HIGH",
      "desc_dante": "Орел описує божественну справедливість як безодню, до якої тварний зір не може сягнути: «a questo fondo» (до цього дна). Образ глибини/безодні як метафори незбагненності Божого суду є прямим біблійним запозиченням.",
      "desc_source": "Псалмопівець каже: «Iudicia tua abyssus multa» - суди Твої безодня велика. Цей вірш є одним з найважливіших біблійних джерел метафори божественного суду як безодні, що перевищує людський розум.",
      "chain": null
    }
  ]
}
