{
  "canto": "Inf. XVIII",
  "cantica": "Inferno",
  "canto_num": 18,
  "verified": true,
  "subtitle_ua": "Восьме коло · Малеболдже · Перший рів · Звідники · Другий рів · Підлесники",
  "summary_ua": "У першому рові Малеболдже біжать два ряди звідників і спокусників, шмагані демонами. Данте впізнає Венедіко Каччанеміко і міфічного Язона. У другому рові підлесники плавають у гнойовому смороді; серед них Алессіо Інтермінеллі з Лукки й куртизанка Таїда з Теренцієвого «Євнуха».",
  "connections": [
    {
      "id": "inf_xviii_01",
      "dante_ref": "XVIII, 1–18",
      "dante_sub": "структура",
      "source_ref": "Aen. VI, 548–627",
      "source_sub": "Тартар — структура",
      "source_author": "Вергілій",
      "type": "STRUCTURE",
      "confidence": "HIGH",
      "desc_dante": "Данте описує Злі Рови (Malebolge) — десять концентричних ровів, з'єднаних мостами. Архітектурна модель зони покарання з чіткою геометрією.",
      "desc_source": "В Aeneis VI Тартар описаний як укріплена структура з потрійними мурами, вогненною рікою Флегетоном і залізною вежею. Модель архітектурно організованого простору кари.",
      "chain": null
    },
    {
      "id": "inf_xviii_02",
      "dante_ref": "XVIII, 28–33",
      "dante_sub": "дві колони грішників",
      "source_ref": "Aen. VI, 477–487",
      "source_sub": "процесія тіней в Аїді",
      "source_author": "Вергілій",
      "type": "STRUCTURE",
      "confidence": "MEDIUM",
      "desc_dante": "У першій ровині дві колони грішників ідуть назустріч одне одному — звідники в один бік, спокусники в інший. Модель зустрічного руху покараних.",
      "desc_source": "В Aeneis VI тіні рухаються процесіями через різні зони Аїду. Організований рух покараних як структурний елемент потойбіччя.",
      "chain": null
    },
    {
      "id": "inf_xviii_03",
      "dante_ref": "XVIII, 28–33",
      "dante_sub": "порівняння з юбілеєм",
      "source_ref": "Aen. VI, 305–316",
      "source_sub": "натовп тіней на березі",
      "source_author": "Вергілій",
      "type": "THEMATIC",
      "confidence": "MEDIUM",
      "desc_dante": "Данте порівнює зустрічний рух грішників із рухом паломників через міст Святого Ангела під час юбілею 1300 року — одні до собору, інші до замку.",
      "desc_source": "В Aeneis VI натовп тіней на березі Ахерону порівнюється з осіннім листям або стаєю птахів. Порівняння потойбічного натовпу з земною реальністю — типова вергіліанська техніка.",
      "chain": null
    },
    {
      "id": "inf_xviii_04",
      "dante_ref": "XVIII, 83–96",
      "dante_sub": "Ясон — спокусник",
      "source_ref": "Met. VII, 1–158",
      "source_sub": "Ясон і Медея",
      "source_author": "Овідій",
      "type": "ALLUSION",
      "confidence": "HIGH",
      "desc_dante": "Вергілій вказує на Ясона, що крокує серед покараних спокусників. Він зваблював Гіпсіпілу на Лемносі та Медею в Колхіді, а потім покинув обох.",
      "desc_source": "У Metamorphoses VII Овідій описує пристрасть Медеї до Ясона, її допомогу в здобутті золотого руна та зраду Ясона, який покинув Медею заради Креуси.",
      "chain": null
    },
    {
      "id": "inf_xviii_05",
      "dante_ref": "XVIII, 86–87",
      "dante_sub": "Ясон на Лемносі",
      "source_ref": "Theb. V, 403–498",
      "source_sub": "Гіпсіпіла на Лемносі",
      "source_author": "Стацій",
      "type": "ALLUSION",
      "confidence": "HIGH",
      "desc_dante": "Данте згадує, як Ясон зваблив Гіпсіпілу на Лемносі, де «ardite femmine» вбили всіх чоловіків. Деталі про Лемнос Данте бере зі Стація.",
      "desc_source": "У Thebais V Стацій подає розгорнуту розповідь Гіпсіпіли про різанину на Лемносі, де жінки вбили чоловіків за зраду. Стацій — головне латинське джерело лемноського міту.",
      "chain": null
    },
    {
      "id": "inf_xviii_06",
      "dante_ref": "XVIII, 86–87",
      "dante_sub": "Ясон і аргонавти",
      "source_ref": "Argonautica, I, 609–910",
      "source_sub": "Ясон зустрічає Гіпсіпілу",
      "source_author": "Валерій Флакк",
      "type": "THEMATIC",
      "confidence": "MEDIUM",
      "desc_dante": "Традиція про Ясона і Гіпсіпілу побутувала в кількох латинських текстах. Данте міг знати версію Валерія Флакка або Стація.",
      "desc_source": "В Argonautica Валерія Флакка Ясон прибуває на Лемнос і зустрічає Гіпсіпілу. Валерій дає романтичну версію зустрічі, яку Стацій потім трансформує у трагічну.",
      "chain": null
    },
    {
      "id": "inf_xviii_07",
      "dante_ref": "XVIII, 92–96",
      "dante_sub": "Ясон — золоте руно",
      "source_ref": "Met. VII, 149–158",
      "source_sub": "Ясон здобуває руно",
      "source_author": "Овідій",
      "type": "ALLUSION",
      "confidence": "HIGH",
      "desc_dante": "Вергілій нагадує, що Ясон «con segni e con parole ornate» зваблив Медею, яка допомогла йому здобути золоте руно, а потім залишив її вагітну.",
      "desc_source": "У Metamorphoses VII Медея зізнається у внутрішньому монолозі, що скорена красою та промовами Ясона. Вона зраджує батька, допомагаючи Ясонові, і згодом покинута.",
      "chain": null
    },
    {
      "id": "inf_xviii_08",
      "dante_ref": "XVIII, 133–136",
      "dante_sub": "Таїда — лестивиця",
      "source_ref": "Eunuchus, III, 1",
      "source_sub": "Таїда — гетера",
      "source_author": "Теренцій",
      "type": "ALLUSION",
      "confidence": "HIGH",
      "desc_dante": "В останній ровині Данте бачить Таїду, що «лестила коханцеві, кажучи: magnas gratias ago». Вергілій ідентифікує її як пута («puttana»).",
      "desc_source": "У комедії Eunuchus Теренція Таїда — гетера, одна з головних персонажок. Фразу «magnas gratias ago» Данте запозичує через Цицерона (De Amicitia, XXVI, 98), який цитує цю сцену.",
      "chain": null
    }
  ]
}
