{
  "canto": "Par. XVII",
  "cantica": "Paradiso",
  "canto_num": 17,
  "verified": true,
  "subtitle_ua": "П'яте небо · Марс · Пророцтво вигнання Данте · Обов'язок свідчити",
  "summary_ua": "Данте просить Каччаґвіду відкрити йому долю. Предок пророкує: він буде вигнаний з Флоренції, спізнає гіркий хліб і чужі сходи, знайде притулок у скалігерів; і все-таки мусить розказати все, що бачив, попри ворожнечу могутніх. Це — свідчення, за яке Данте пише Комедію.",
  "connections": [
    {
      "id": "par_xvii_01",
      "dante_ref": "XVII, 1-6",
      "dante_sub": "Фаетон шукає правди у Клімени",
      "source_ref": "Met. I, 747-779",
      "source_sub": "Фаетон іде до матері за підтвердженням батьківства",
      "source_author": "Овідій",
      "type": "ALLUSION",
      "confidence": "HIGH",
      "desc_dante": "Данте порівнює себе з Фаетоном, який прийшов до матері Клімени, щоб перевірити чутки про своє походження. Так само Данте звертається до предка Каччагвіди, щоб отримати підтвердження темних пророцтв про своє вигнання.",
      "desc_source": "В Met. I Епаф глузує з Фаетона, стверджуючи, що той не є сином Сонця. Фаетон біжить до матері Клімени за правдою, і вона клянеться у його божественному походженні, вказуючи шлях до палацу Геліоса.",
      "chain": null
    },
    {
      "id": "par_xvii_02",
      "dante_ref": "XVII, 46-48",
      "dante_sub": "Іполіт вигнаний з Атен через мачуху",
      "source_ref": "Met. XV, 497-546",
      "source_sub": "Іполіт розповідає про вигнання через Федру",
      "source_author": "Овідій",
      "type": "ALLUSION",
      "confidence": "HIGH",
      "desc_dante": "Каччагвіда порівнює долю Данте з Іполітом, якого вигнали з Атен через наклеп «жорстокої й віроломної мачухи» Федри. Так само Данте буде змушений покинути Флоренцію через неправедні звинувачення.",
      "desc_source": "В Met. XV Іполіт (під ім'ям Вірбій) сам розповідає свою історію: Федра обмовила його перед Тесеєм, батько прокляв сина, призвавши гнів Нептуна, і Іполіт був змушений тікати з Атен.",
      "chain": null
    },
    {
      "id": "par_xvii_03",
      "dante_ref": "XVII, 46-48",
      "dante_sub": "Іполіт, Федра та хибне звинувачення",
      "source_ref": "Phaedra 896-958",
      "source_sub": "Тесей вірить Федрі й проклинає Іполіта",
      "source_author": "Сенека",
      "type": "ALLUSION",
      "confidence": "MEDIUM",
      "desc_dante": "Данте використовує образ Іполіта як парадигму несправедливого вигнання. Сенеківська трагедія давала Данте драматичну версію сюжету, де батько проклинає невинного сина на підставі фальшивого звинувачення.",
      "desc_source": "У Phaedra Сенеки Тесей повертається й застає Федру зі звинуваченнями проти Іполіта. Не слухаючи захисту сина, Тесей викликає прокляття Нептуна, засуджуючи Іполіта до вигнання й загибелі.",
      "chain": null
    },
    {
      "id": "par_xvii_04",
      "dante_ref": "XVII, 31-99",
      "dante_sub": "Каччагвіда пророкує майбутнє Данте",
      "source_ref": "Aen. VI, 756-886",
      "source_sub": "Анхіз пророкує майбутнє Риму Енеєві",
      "source_author": "Вергілій",
      "type": "STRUCTURE",
      "confidence": "HIGH",
      "desc_dante": "Каччагвіда, предок Данте, відкриває йому долю: вигнання, поневіряння, притулок у Делла Скала. Структура сцени повторює модель Енеїди: предок у потойбіччі пророкує нащадкові його долю та славу його роду.",
      "desc_source": "В Aeneis VI Анхіз показує Енеєві процесію майбутніх римських героїв, пророкуючи велич Риму та місію Енея як засновника нової батьківщини. Ця сцена є центральним пророчим епізодом латинського епосу.",
      "chain": null
    },
    {
      "id": "par_xvii_05",
      "dante_ref": "XVII, 46-48",
      "dante_sub": "несправедливе вигнання з рідного міста",
      "source_ref": "Aen. VI, 860-886",
      "source_sub": "Анхіз оплакує Марцелла",
      "source_author": "Вергілій",
      "type": "INVERSION",
      "confidence": "MEDIUM",
      "desc_dante": "Каччагвіда пророкує вигнання Данте, і його пророцтво, як і слова Анхіза, містить гіркоту. Але Данте інвертує ситуацію: у Вергілія предок оплакує передчасну смерть нащадка, а у Данте предок пророкує вигнання, яке стане джерелом літературної слави.",
      "desc_source": "В Aeneis VI Анхіз завершує показ майбутніх героїв Риму плачем над молодим Марцеллом, якому судилася рання смерть. «Tu Marcellus eris» - один з найтрагічніших моментів пророцтва, де провіщення обертається жалобою.",
      "chain": null
    },
    {
      "id": "par_xvii_06",
      "dante_ref": "XVII, 55-60",
      "dante_sub": "гіркий хліб вигнання та чужі сходи",
      "source_ref": "Cons. I, pr. 4, 35–50",
      "source_sub": "Боецій описує своє несправедливе засудження та вигнання",
      "source_author": "Боецій",
      "type": "THEMATIC",
      "confidence": "HIGH",
      "desc_dante": "Данте описує конкретні страждання вигнанця: «дізнаєшся, який солоний смак чужого хліба» і як тяжко «сходити й підніматися чужими сходами» - залежність від чужої ласки, втрата гідності.",
      "desc_source": "В Consolatio I, pr. 4 Боецій описує свій несправедливий вирок: хибні звинувачення, віддалення від сенату, конфіскацію майна. Досвід вигнаного інтелектуала, який залежить від чужої милості, є прямою тематичною паралеллю.",
      "chain": null
    },
    {
      "id": "par_xvii_07",
      "dante_ref": "XVII, 55-60",
      "dante_sub": "страждання на чужині",
      "source_ref": "Tristia I, 3, 47-68",
      "source_sub": "Овідій описує ніч розлуки з Римом",
      "source_author": "Овідій",
      "type": "THEMATIC",
      "confidence": "MEDIUM",
      "desc_dante": "Каччагвіда малює Данте картину вигнання: невблаганне розлучення з батьківщиною, солоний хліб чужини. Данте стає частиною великої класичної традиції поетів-вигнанців.",
      "desc_source": "В Tristia I, 3 Овідій описує свою останню ніч у Римі: плач дружини, прощання з домом, агонію розлуки з усім, що йому дороге. Це канонічний текст латинської літератури про біль вигнання.",
      "chain": null
    },
    {
      "id": "par_xvii_08",
      "dante_ref": "XVII, 121-142",
      "dante_sub": "Каччагвіда наказує писати правду",
      "source_ref": "Met. XV, 871-879",
      "source_sub": "Овідій проголошує безсмертя своєї поеми",
      "source_author": "Овідій",
      "type": "THEMATIC",
      "confidence": "MEDIUM",
      "desc_dante": "Каччагвіда наказує Данте відкрити все, що він бачив, навіть якщо його слова будуть гіркими. Це літературна місія: поет має говорити правду, і його твір переживе сучасників.",
      "desc_source": "В епілозі Metamorphoses Овідій проголошує: «Iamque opus exegi» - я завершив працю, яку не знищать ні гнів Юпітера, ні вогонь. Модель поета, чий твір забезпечує йому вічну славу, є фундаментальним топосом латинської поезії.",
      "chain": null
    },
    {
      "id": "par_xvii_09",
      "dante_ref": "XVII, 133-138",
      "dante_sub": "удар по найвищих вершинах",
      "source_ref": "Carm. II, 10, 9-12",
      "source_sub": "найвищі сосни падають від вітру",
      "source_author": "Горацій",
      "type": "THEMATIC",
      "confidence": "MEDIUM",
      "desc_dante": "Каччагвіда пояснює, чому Данте має називати лише відомих: «s'al primo gusto, vital nutrimento / lascera poi» - правда спершу гірка, але згодом живить. Його слова торкнуться «найвищих вершин», тобто найвпливовіших осіб.",
      "desc_source": "В Carmina II, 10 Горацій формулює принцип aurea mediocritas: найвищі сосни частіше валить вітер, найвищі вежі падають з найбільшим гуркотом. Мотив уразливості могутніх є класичним топосом.",
      "chain": null
    },
    {
      "id": "par_xvii_10",
      "dante_ref": "XVII, 1-9",
      "dante_sub": "нащадок шукає правди у предка",
      "source_ref": "Aen. VI, 684-702",
      "source_sub": "Еней зустрічає Анхіза в Елізіумі",
      "source_author": "Вергілій",
      "type": "STRUCTURE",
      "confidence": "HIGH",
      "desc_dante": "Данте звертається до Каччагвіди з тривогою, шукаючи правди про своє майбутнє. Емоційна структура сцени - нащадок у потойбіччі, сповнений тривоги, зустрічає предка, який володіє знанням - повторює зустріч Енея з Анхізом.",
      "desc_source": "В Aeneis VI Еней нарешті знаходить Анхіза на Елісейських полях. Батько й син зустрічаються зі сльозами, тричі Еней намагається обійняти тінь батька. Потім Анхіз починає розкривати майбутнє.",
      "chain": null
    },
    {
      "id": "par_xvii_11",
      "dante_ref": "XVII, 106-108",
      "dante_sub": "великі діяння, негідні мовчання",
      "source_ref": "Aen. VI, 806-807",
      "source_sub": "подвиги Августа перевершать Геракла",
      "source_author": "Вергілій",
      "type": "THEMATIC",
      "confidence": "MEDIUM",
      "desc_dante": "Каччагвіда описує майбутні подвиги Канґранде, про які замовчати було б ганьбою. Модель пророцтва про великого правителя-воїна через перелік його майбутніх звершень.",
      "desc_source": "В Aeneis VI Анхіз пророкує про Августа, чиї діяння перевершать подорожі Геракла й Діоніса. Панегірична структура пророцтва про правителя-рятівника, вплетена у візію потойбіччя, стає моделлю для Дантового опису Канґранде.",
      "chain": null
    }
  ]
}
