{
  "canto": "Purg. XVII",
  "cantica": "Purgatorio",
  "canto_num": 17,
  "verified": true,
  "subtitle_ua": "Третя тераса · Приклади гніву · Янгол миру · Четверта тераса · Лінивці · Структура любові",
  "summary_ua": "Данте в стані екстазу бачить приклади покараного гніву: Прокну, Амана, Лавінію. Янгол миру стирає третє P. На четвертій терасі Вергілій виголошує великий виклад любові як основи всіх рухів душі: любов, скерована правильно або хибно, — джерело всіх чеснот і гріхів.",
  "connections": [
    {
      "id": "purg_xvii_01",
      "dante_ref": "XVII, 19–21",
      "dante_sub": "видіння: Прокне",
      "source_ref": "Met. VI, 424–674",
      "source_sub": "Прокне і Філомела",
      "source_author": "Овідій",
      "type": "ALLUSION",
      "confidence": "HIGH",
      "desc_dante": "У першому видінні покараного гніву Данте бачить Прокне, перетворену на соловейка після того, як у сліпій люті вбила й нагодувала власного сина батькові Терею.",
      "desc_source": "В Metamorphoses VI Овідій описує жахливу помсту Прокне: дізнавшись, що чоловік Терей згвалтував її сестру Філомелу, вона вбиває сина Ітіса і подає його батькові на вечерю. Exemplum гніву, що перетворюється на жорстокість.",
      "chain": null
    },
    {
      "id": "purg_xvii_02",
      "dante_ref": "XVII, 25–30",
      "dante_sub": "видіння: розп'ятий Аман",
      "source_ref": "Esth. 7:9–10",
      "source_sub": "Аман повішений",
      "source_author": "Біблія",
      "type": "ALLUSION",
      "confidence": "HIGH",
      "desc_dante": "У другому видінні Данте бачить Амана, розп'ятого за свій гнівний план знищити єврейський народ. Поруч стоять Естер, Ахашверош і Мордехай.",
      "desc_source": "У Книзі Естер Аман, розгніваний відмовою Мордехая вклонитися, планує знищення всіх юдеїв. Естер викриває його, і Аман повішений на шибениці, яку сам підготував для Мордехая.",
      "chain": null
    },
    {
      "id": "purg_xvii_03",
      "dante_ref": "XVII, 34–39",
      "dante_sub": "видіння: Лавінія оплакує Амату",
      "source_ref": "Aen. XII, 593–607",
      "source_sub": "самогубство Амати",
      "source_author": "Вергілій",
      "type": "ALLUSION",
      "confidence": "HIGH",
      "desc_dante": "Третє видіння: дівчина гірко плаче: «О цариця, чому від гніву ти вирішила не бути?» — Лавінія оплакує матір Амату, що повісилась від гніву.",
      "desc_source": "В Aeneis XII Амата, дружина Латіна, повісилась, хибно вважаючи Турна загиблим. Її гнів проти Енея та троянців, роздмуханий Аллекто (Aen. VII), призвів до самознищення.",
      "chain": null
    },
    {
      "id": "purg_xvii_04",
      "dante_ref": "XVII, 91–105",
      "dante_sub": "любов як корінь усіх дій",
      "source_ref": "Aen. VI, 730–734",
      "source_sub": "вогняна сила духу",
      "source_author": "Вергілій",
      "type": "THEMATIC",
      "confidence": "MEDIUM",
      "desc_dante": "Вергілій починає свій discorso: кожна дія — і доброчесна, і грішна — походить від любові. Любов — природний рух душі до блага. Моральна теорія Чистилища.",
      "desc_source": "В Aeneis VI Анхіз пояснює, що всі душі мають igneus vigor — вогняну силу, яка є їхнім рушієм. Данте розвиває цю вергіліанську ідею, ототожнюючи рушійну силу з любов'ю.",
      "chain": null
    },
    {
      "id": "purg_xvii_05",
      "dante_ref": "XVII, 112–114",
      "dante_sub": "млявість як спотворена любов",
      "source_ref": "Ps. 118:28",
      "source_sub": "задрімала душа моя від нудьги",
      "source_author": "Біблія",
      "type": "THEMATIC",
      "confidence": "MEDIUM",
      "desc_dante": "Вергілій описує accidia як недостатню любов до блага — душевну млявість. Четверта тераса (ліне) є центральною в семиступеневій схемі Чистилища.",
      "desc_source": "Псалом 118 (119) містить зітхання: «Dormitavit anima mea prae taedio» — душа моя задрімала від нудьги. Мотив духовної сонливості як гріха проти активної любові.",
      "chain": null
    },
    {
      "id": "purg_xvii_06",
      "dante_ref": "XVII, 91–96",
      "dante_sub": "любов як джерело всякої дії",
      "source_ref": "NE II, 3, 1104b30–1105a1",
      "source_sub": "задоволення і біль як мотиви",
      "source_author": "Аристотель",
      "type": "STRUCTURE",
      "confidence": "HIGH",
      "desc_dante": "Вергілій починає виклад: «Né creator né creatura mai...fu sanza amore, o naturale o d'animo». Любов природна або розумна — корінь усіх вчинків, і саме вона скеровує до блага або до гріха. Структура всього Чистилища побудована на цій тезі.",
      "desc_source": "У Нікомаховій Етиці II, 3 Аристотель аналізує задоволення й біль як мотиви людських дій. Чеснота полягає в правильному скеруванні потягу до належних об'єктів. Через коментар Томи Аквінського цей виклад стає основою дантівського вчення про любов.",
      "chain": [
        {
          "ref": "Sententia libri Ethicorum II, 2",
          "author": "Тома Аквінський",
          "sub": "коментар до Етики",
          "desc": "Коментар Томи Аквінського до Нікомахової Етики (бл. 1271) використовував переклад Вільяма з Мербеке. Саме ця томістична інтерпретація аристотелівської психології любові передана Данте."
        }
      ]
    }
  ]
}
