{
  "canto": "Purg. XXXII",
  "cantica": "Purgatorio",
  "canto_num": 32,
  "verified": true,
  "subtitle_ua": "Земний Рай · Дерево пізнання · Видіння історії Церкви · Вавилонська блудниця",
  "summary_ua": "Процесія рухається далі, і Гриф прив'язує колісницю до висхлого дерева (пізнання добра і зла), яке миттєво вкривається цвітом. У видінні Данте бачить послідовні напади на Церкву — орел переслідувань, лисиця єресі, дракон-Іслам, рогатий звір (розкіш), велетень із блудницею, що символізують папство у Авіньйоні.",
  "connections": [
    {
      "id": "purg_xxxii_01",
      "dante_ref": "XXXII, 37–42",
      "dante_sub": "очі засліплені сяйвом Беатріче",
      "source_ref": "Act. 9:3–8",
      "source_sub": "Савл засліплений на дорозі до Дамаска",
      "source_author": "Біблія",
      "type": "ALLUSION",
      "confidence": "MEDIUM",
      "desc_dante": "Данте дивиться на Беатріче так пильно, що його очі засліплені її сяйвом — «li occhi abbagliati». Він тимчасово осліплений надмірним світлом істини, як апостол, що зустрів божественне.",
      "desc_source": "У Діяннях Апостолів Савл на дорозі до Дамаска раптово осяяний світлом з неба: «subito circumfulsit eum lux de caelo» — і сліпне на три дні. Осліплення як наслідок зустрічі з божественним випромінюванням.",
      "chain": null
    },
    {
      "id": "purg_xxxii_02",
      "dante_ref": "XXXII, 40–42",
      "dante_sub": "Аргус приспаний Меркурієм",
      "source_ref": "Met. I, 625–723",
      "source_sub": "Меркурій присипляє Арґуса",
      "source_author": "Овідій",
      "type": "ALLUSION",
      "confidence": "HIGH",
      "desc_dante": "Данте порівнює себе з Аргусом, чию стоочність приспав Меркурій — метафора пильності, переможеної вищою силою. «S'io potessi ritrar come assonnaro / li occhi spietati» — якби він міг зобразити, як засинають невблаганні очі.",
      "desc_source": "В Метаморфозах Овідія Меркурій убиває стоокого Аргуса, якого Юнона поставила стерегти Іо. Спершу він приспав усі сто очей грою на сирінзі, потім убив — «centum luminibus cinctum caput Argus habebat». Аргус як архетип нездоланної пильності.",
      "chain": null
    },
    {
      "id": "purg_xxxii_03",
      "dante_ref": "XXXII, 52–60",
      "dante_sub": "дерево в Едемі, позбавлене листя",
      "source_ref": "Gen. 2:17",
      "source_sub": "дерево пізнання добра і зла",
      "source_author": "Біблія",
      "type": "ALLUSION",
      "confidence": "HIGH",
      "desc_dante": "Процесія підходить до велетенського дерева, позбавленого листя і квітів — «d'ogne fronda spogliata». Дерево стоїть голе як наслідок першого непослуху, коли Адам і Єва скуштували заборонений плід.",
      "desc_source": "У Книзі Буття Бог забороняє їсти плоди з дерева пізнання добра і зла: «de ligno autem scientiae boni et mali ne comedas». Порушення заборони призводить до гріхопадіння та вигнання з Раю.",
      "chain": null
    },
    {
      "id": "purg_xxxii_04",
      "dante_ref": "XXXII, 61–63",
      "dante_sub": "дерево оновлюється від дотику дишла",
      "source_ref": "Gen. 3:3",
      "source_sub": "дерево посеред Раю",
      "source_author": "Біблія",
      "type": "THEMATIC",
      "confidence": "HIGH",
      "desc_dante": "Коли грифон торкає дишлом колісниці оголеного дерева, воно раптово оновлюється — пускає нове листя і квіти. Дишло = Хрест, дотик якого відновлює те, що було зруйноване гріхопадінням.",
      "desc_source": "Дерево посеред Раю (Gen. 3:3) — центральний символ заборони і гріхопадіння. В екзегетичній традиції Хрест Розп'яття ототожнюється з деревом Едему: дерево смерті стає деревом спасіння через новий завіт.",
      "chain": null
    },
    {
      "id": "purg_xxxii_05",
      "dante_ref": "XXXII, 64–69",
      "dante_sub": "колір між трояндою і фіалкою",
      "source_ref": "Georg. II, 319–323",
      "source_sub": "пурпурова весна",
      "source_author": "Вергілій",
      "type": "THEMATIC",
      "confidence": "MEDIUM",
      "desc_dante": "Оновлене дерево набирає кольору «men che di rose e piu che di viole» — менше, ніж троянди, більше, ніж фіалки. Весняне оновлення природи як знак духовного відродження.",
      "desc_source": "У Георгіках Вергілій описує настання весни: «ver adeo frondi nemorum, ver utile silvis, / vere tument terrae et genitalia semina poscunt» — весна як час пурпурового оновлення. Мотив весняного цвітіння й відродження природи.",
      "chain": null
    },
    {
      "id": "purg_xxxii_06",
      "dante_ref": "XXXII, 109–117",
      "dante_sub": "орел атакує колісницю",
      "source_ref": "Apoc. 12:3–4",
      "source_sub": "великий червоний дракон",
      "source_author": "Біблія",
      "type": "ALLUSION",
      "confidence": "HIGH",
      "desc_dante": "Данте бачить, як орел стрімголов падає крізь дерево і вдаряє в колісницю, розносячи кору і квіти — алегорія римських гонінь на ранню Церкву. Орел = Римська імперія.",
      "desc_source": "В Apocalypsis великий червоний дракон із сімома головами стоїть перед жінкою, що має народити, щоб пожерти її дитя. Образ ворожої сили, що атакує Церкву. Данте замінює дракона на орла, конкретизуючи алегорію.",
      "chain": null
    },
    {
      "id": "purg_xxxii_07",
      "dante_ref": "XXXII, 118–123",
      "dante_sub": "лисиця входить у колісницю",
      "source_ref": "Cant. 2:15",
      "source_sub": "ловіть нам лисенят",
      "source_author": "Біблія",
      "type": "ALLUSION",
      "confidence": "MEDIUM",
      "desc_dante": "Лисиця стрибає всередину колісниці — худа, немов не знала доброї їжі. Вона символізує єресі, що проникають у Церкву зсередини. Беатріче проганяє її.",
      "desc_source": "У Пісні Пісень наречений каже: «capite nobis vulpes, vulpes parvulas, quae demoliuntur vineas» — «зловіть нам лисиць, маленьких лисиць, що нищать виноградники». В екзегезі лисиці — єретики, що руйнують виноградник Церкви.",
      "chain": null
    },
    {
      "id": "purg_xxxii_08",
      "dante_ref": "XXXII, 130–135",
      "dante_sub": "дракон проломлює дно колісниці",
      "source_ref": "Apoc. 12:3–4",
      "source_sub": "дракон змітає зірки хвостом",
      "source_author": "Біблія",
      "type": "ALLUSION",
      "confidence": "HIGH",
      "desc_dante": "Дракон виходить з-під землі, встромлює хвіст у дно колісниці і відламує частину — алегорія великого розколу, що відриває частину Церкви. Колісниця залишається пошкодженою.",
      "desc_source": "В Apocalypsis дракон змітає хвостом третину зірок з неба: «cauda eius trahebat tertiam partem stellarum caeli». Хвіст як знаряддя руйнування. Данте конкретизує: хвіст дракона вириває частину дна колісниці-Церкви.",
      "chain": null
    },
    {
      "id": "purg_xxxii_09",
      "dante_ref": "XXXII, 148–153",
      "dante_sub": "блудниця і велетень на колісниці",
      "source_ref": "Apoc. 17:1–6",
      "source_sub": "велика блудниця",
      "source_author": "Біблія",
      "type": "ALLUSION",
      "confidence": "HIGH",
      "desc_dante": "На спотвореній колісниці з'являється розпусна жінка — «puttana sciolta» — з велетнем поруч, що її цілує. Алегорія зіпсованого папства під впливом французької корони.",
      "desc_source": "В Apocalypsis Іоанн бачить «великую блудницю, що сидить на водах великих» — «meretrix magna, quae sedet super aquas multas» — Вавилон. Вона одягнена в пурпур, тримає золоту чашу повну мерзот — алегорія зіпсованої влади.",
      "chain": null
    }
  ]
}
