{
  "canto": "Par. XIV",
  "cantica": "Paradiso",
  "canto_num": 14,
  "verified": true,
  "subtitle_ua": "Четверте небо · Сонце · Воскресіння плоті · Підйом у Марс · Хрест воїнів",
  "summary_ua": "Соломон пояснює, що по воскресінні плоть додасть, а не відніме славу блаженних. Пілігрими здіймаються у сферу Марса, де душі воїнів-мучеників утворюють багряно-золотий Хрест Христовий у небі. Гімн, який вони співають, настільки прекрасний, що Данте зізнається — тут його перо безсиле.",
  "connections": [
    {
      "id": "par_xiv_01",
      "dante_ref": "XIV, 37–60",
      "dante_sub": "Соломон про воскресіння тіла і його сяйво",
      "source_ref": "1 Cor. 15:42–54",
      "source_sub": "тіло воскресає в нетлінні",
      "source_author": "Біблія",
      "type": "ALLUSION",
      "confidence": "HIGH",
      "desc_dante": "Соломон відповідає на питання про долю тіл після воскресіння: сяйво блаженних душ зросте, коли вони повернуть свої тіла, бо тілесне зір стане досконалішим. Його промова безпосередньо спирається на Павлову доктрину воскресіння тіла.",
      "desc_source": "У Першому посланні до коринтян Павло описує воскресіння тіла: «seminatur in corruptione, surget in incorruptione; seminatur in ignobilitate, surget in gloria» (15:42-43). Тіло, посіяне в тлінні, воскресає в нетлінні та славі, що стає основою Дантової візії яскравішого сяйва воскреслих.",
      "chain": null
    },
    {
      "id": "par_xiv_02",
      "dante_ref": "XIV, 43–51",
      "dante_sub": "світло душ зросте з повернутими тілами",
      "source_ref": "Sap. 3:7",
      "source_sub": "праведники сяятимуть як іскри",
      "source_author": "Біблія",
      "type": "ALLUSION",
      "confidence": "HIGH",
      "desc_dante": "Соломон стверджує, що світло блаженних душ зросте, коли вони повернуть свої тіла: плоть буде не перешкодою, а органом досконалішого зору й сяяння. Образ «fulgebunt iusti» прямо резонує тут.",
      "desc_source": "Книга Премудрості Соломонової пророкує: «fulgebunt iusti, et tamquam scintillae in arundineto discurrent» (праведники сяятимуть і розбіжаться як іскри серед стерні). Образ тілесного сяяння праведних у потойбіччі став основою Дантового бачення зростаючого світла душ.",
      "chain": null
    },
    {
      "id": "par_xiv_03",
      "dante_ref": "XIV, 34–36",
      "dante_sub": "Соломон як наймудріший промовець",
      "source_ref": "3 Reg. 3:12",
      "source_sub": "Бог дарує Соломону мудрість",
      "source_author": "Біблія",
      "type": "ONOMASTIC",
      "confidence": "HIGH",
      "desc_dante": "Данте вкладає відповідь про воскресіння тіла саме в уста Соломона, найяснішого світла серед мудреців. Вибір промовця зумовлений біблійною репутацією Соломона як наймудрішого з людей.",
      "desc_source": "У Третій книзі Царств Бог каже Соломону: «dedi tibi cor sapiens et intelligens, in tantum ut nullus ante te similis tui fuerit» (3:12). Дарована надприродна мудрість робить Соломона авторитетним голосом для доктринального дискурсу.",
      "chain": null
    },
    {
      "id": "par_xiv_04",
      "dante_ref": "XIV, 52–57",
      "dante_sub": "блаженні прагнуть повернути тіла заради близьких",
      "source_ref": "2 Cor. 5:1–4",
      "source_sub": "прагнення небесного одягнення тіла",
      "source_author": "Біблія",
      "type": "THEMATIC",
      "confidence": "MEDIUM",
      "desc_dante": "Соломон описує прагнення блаженних душ повернути свої тіла: не заради себе, а заради матерів, батьків і близьких, яких вони любили. Прагнення тілесного воскресіння як акт любові до інших.",
      "desc_source": "У Другому посланні до коринтян Павло описує стогін смертних, які бажають «не роздягтися, а зодягнутися» (supervestiri), щоб смертне було поглинуте життям. Мотив прагнення тіла не як тягаря, а як додаткової повноти буття.",
      "chain": null
    },
    {
      "id": "par_xiv_05",
      "dante_ref": "XIV, 97–99",
      "dante_sub": "порівняння хреста з Чумацьким Шляхом",
      "source_ref": "Met. I, 168–171",
      "source_sub": "Чумацький Шлях - дорога до палацу Юпітера",
      "source_author": "Овідій",
      "type": "ALLUSION",
      "confidence": "HIGH",
      "desc_dante": "Данте порівнює хрест Марса із Галаксією (Чумацьким Шляхом), що «білизною сяє між полюсами» (biancheggia tra' poli). Це астрономічне порівняння апелює до відомого овідіанського опису.",
      "desc_source": "В Met. I Овідій описує Чумацький Шлях як дорогу до палацу Юпітера: «est via sublimis, caelo manifesta sereno, / lactea nomen habet, candore notabilis ipso» (168-169). Образ зоряної смуги як небесного шляху, помітного своєю білизною, став канонічним для середньовічних поетів.",
      "chain": null
    },
    {
      "id": "par_xiv_06",
      "dante_ref": "XIV, 100–105",
      "dante_sub": "Христос блискавицею сяє на хресті",
      "source_ref": "Matt. 27:32–44",
      "source_sub": "розп'яття Христа на хресті",
      "source_author": "Біблія",
      "type": "INVERSION",
      "confidence": "HIGH",
      "desc_dante": "Данте бачить Христа, який блискавицею пробігає вздовж хреста з променів на небі Марса. Хрест з інструмента страти перетворюється на знаряддя слави: Христос не страждає на ньому, а випромінює сяйво.",
      "desc_source": "Євангеліст Матвій описує розп'яття Христа: Його ведуть на Голгофу, прибивають до хреста, глузують з Нього. Хрест є інструментом ганебної страти. Данте інвертує цей образ: небесний хрест з променів є тріумфальним, а Христос сяє на ньому замість страждання.",
      "chain": null
    },
    {
      "id": "par_xiv_07",
      "dante_ref": "XIV, 104",
      "dante_sub": "хто бере свій хрест і йде за Христом",
      "source_ref": "Matt. 10:38",
      "source_sub": "хто не бере хреста і не йде за Мною",
      "source_author": "Біблія",
      "type": "ALLUSION",
      "confidence": "HIGH",
      "desc_dante": "Данте каже, що той, хто бере свій хрест і йде за Христом («chi prende sua croce e segue Cristo»), вибачить йому невміння описати цей блиск. Це майже дослівна цитата з Євангелія.",
      "desc_source": "Христос у Євангелії від Матвія каже: «qui non accipit crucem suam et sequitur me, non est me dignus» (10:38). Вислів про несення хреста як умову учнівства стає у Данте критерієм для тих, хто здатен зрозуміти небесну красу.",
      "chain": null
    },
    {
      "id": "par_xiv_08",
      "dante_ref": "XIV, 100–105",
      "dante_sub": "Христос сяє на хресті як блискавка",
      "source_ref": "Matt. 17:1–8",
      "source_sub": "Преображення Христа на горі Табор",
      "source_author": "Біблія",
      "type": "THEMATIC",
      "confidence": "MEDIUM",
      "desc_dante": "Данте бачить Христа, який блискавицею пробігає вздовж хреста, випромінюючи надприродне сяйво, що перевищує будь-яке земне уявлення. Образ сяючого Христа відлунює євангельський мотив Преображення.",
      "desc_source": "У Євангелії від Матвія Христос на горі Табор преображається перед учнями: «resplenduit facies eius sicut sol, vestimenta autem eius facta sunt alba sicut nix» (17:2). Мотив Христового тіла, що випромінює надприродне світло, є структурним прообразом Дантового бачення.",
      "chain": null
    },
    {
      "id": "par_xiv_09",
      "dante_ref": "XIV, 118–123",
      "dante_sub": "гімн на хресті перевищує земну красу",
      "source_ref": "Cons. II, m. 8, 13–30",
      "source_sub": "космічна гармонія, керована любов'ю",
      "source_author": "Боецій",
      "type": "THEMATIC",
      "confidence": "MEDIUM",
      "desc_dante": "Данте чує мелодію на хресті, яка зачаровує його, хоч він не розуміє слів гімну. Будь-яка найсолодша земна мелодія здавалася б розірваною хмарою грому порівняно з цією. Мотив небесної музики, що перевищує людське сприйняття.",
      "desc_source": "У Consolatio II, metrum 8 Боецій оспівує космічну гармонію: «quod mundus stabili fide / concordes variat vices... haec concordia temperat / aequis elementa modis». Любов як сила, що тримає в гармонії всесвіт, резонує з Дантовим образом невимовної небесної музики.",
      "chain": null
    }
  ]
}
